code,name,category
TM.VAL.FUEL.ZS.UN,Fuel imports (% of merchandise imports),Private Sector
TX.VAL.TECH.MF.ZS,High-technology exports (% of manufactured exports),Private Sector
TX.VAL.TECH.CD,High-technology exports (current US$),Private Sector
TX.VAL.ICTG.ZS.UN,ICT goods exports (% of total goods exports),Private Sector
TM.VAL.ICTG.ZS.UN,ICT goods imports (% total goods imports),Private Sector
TM.UVI.MRCH.XD.WD,Import unit value index (2015 = 100),Private Sector
TM.VAL.MRCH.XD.WD,Import value index (2015 = 100),Private Sector
TM.QTY.MRCH.XD.WD,Import volume index (2015 = 100),Private Sector
IC.FRM.CORR.ZS,Informal payments to public officials (% of firms),Private Sector
TX.VAL.INSF.ZS.WT,Insurance and financial services (% of commercial service exports),Private Sector
TM.VAL.INSF.ZS.WT,Insurance and financial services (% of commercial service imports),Private Sector
BX.GSR.INSF.ZS,"Insurance and financial services (% of service exports, BoP)",Private Sector
BM.GSR.INSF.ZS,"Insurance and financial services (% of service imports, BoP)",Private Sector
ST.INT.XPND.MP.ZS,"International tourism, expenditures (% of total imports)",Private Sector
ST.INT.XPND.CD,"International tourism, expenditures (current US$)",Private Sector
ST.INT.TRNX.CD,"International tourism, expenditures for passenger transport items (current US$)",Private Sector
ST.INT.TVLX.CD,"International tourism, expenditures for travel items (current US$)",Private Sector
ST.INT.ARVL,"International tourism, number of arrivals",Private Sector
ST.INT.DPRT,"International tourism, number of departures",Private Sector
ST.INT.RCPT.XP.ZS,"International tourism, receipts (% of total exports)",Private Sector
ST.INT.RCPT.CD,"International tourism, receipts (current US$)",Private Sector
ST.INT.TRNR.CD,"International tourism, receipts for passenger transport items (current US$)",Private Sector
ST.INT.TVLR.CD,"International tourism, receipts for travel items (current US$)",Private Sector
IE.PPI.ENGY.CD,Investment in energy with private participation (current US$),Private Sector
IE.PPI.TRAN.CD,Investment in transport with private participation (current US$),Private Sector
IE.PPI.WATR.CD,Investment in water and sanitation with private participation (current US$),Private Sector
IC.TAX.LABR.CP.ZS,Labor tax and contributions (% of commercial profits),Private Sector
LP.EXP.DURS.MD,"Lead time to export, median case (days)",Private Sector
LP.IMP.DURS.MD,"Lead time to import, median case (days)",Private Sector
LP.LPI.TRAC.XQ,Logistics performance index: Ability to track and trace consignments (1=low to 5=high),Private Sector
LP.LPI.LOGS.XQ,Logistics performance index: Competence and quality of logistics services (1=low to 5=high),Private Sector
LP.LPI.ITRN.XQ,Logistics performance index: Ease of arranging competitively priced shipments (1=low to 5=high),Private Sector
LP.LPI.CUST.XQ,Logistics performance index: Efficiency of customs clearance process (1=low to 5=high),Private Sector
LP.LPI.TIME.XQ,Logistics performance index: Frequency with which shipments reach consignee within scheduled or expected time (1=low to 5=high),Private Sector
LP.LPI.OVRL.XQ,Logistics performance index: Overall (1=low to 5=high),Private Sector
LP.LPI.INFR.XQ,Logistics performance index: Quality of trade and transport-related infrastructure (1=low to 5=high),Private Sector
IC.FRM.CRIM.ZS,Losses due to theft and vandalism (% of annual sales for affected firms),Private Sector
TX.VAL.MANF.ZS.UN,Manufactures exports (% of merchandise exports),Private Sector
TM.VAL.MANF.ZS.UN,Manufactures imports (% of merchandise imports),Private Sector
TX.MNF.TECH.ZS.UN,Medium and high-tech exports (% manufactured exports),Private Sector
TX.VAL.MRCH.CD.WT,Merchandise exports (current US$),Private Sector
TX.VAL.MRCH.WL.CD,Merchandise exports by the reporting economy (current US$),Private Sector
TX.VAL.MRCH.RS.ZS,"Merchandise exports by the reporting economy, residual (% of total merchandise exports)",Private Sector
TX.VAL.MRCH.AL.ZS,Merchandise exports to economies in the Arab World (% of total merchandise exports),Private Sector
TX.VAL.MRCH.HI.ZS,Merchandise exports to high-income economies (% of total merchandise exports),Private Sector
TX.VAL.MRCH.R1.ZS,Merchandise exports to low- and middle-income economies in East Asia & Pacific (% of total merchandise exports),Private Sector
TX.VAL.MRCH.R2.ZS,Merchandise exports to low- and middle-income economies in Europe & Central Asia (% of total merchandise exports),Private Sector
TX.VAL.MRCH.R3.ZS,Merchandise exports to low- and middle-income economies in Latin America & the Caribbean (% of total merchandise exports),Private Sector
TX.VAL.MRCH.R4.ZS,Merchandise exports to low- and middle-income economies in Middle East & North Africa (% of total merchandise exports),Private Sector
TX.VAL.MRCH.R5.ZS,Merchandise exports to low- and middle-income economies in South Asia (% of total merchandise exports),Private Sector
TX.VAL.MRCH.R6.ZS,Merchandise exports to low- and middle-income economies in Sub-Saharan Africa (% of total merchandise exports),Private Sector
TX.VAL.MRCH.OR.ZS,Merchandise exports to low- and middle-income economies outside region (% of total merchandise exports),Private Sector
TX.VAL.MRCH.WR.ZS,Merchandise exports to low- and middle-income economies within region (% of total merchandise exports),Private Sector
TM.VAL.MRCH.CD.WT,Merchandise imports (current US$),Private Sector
TM.VAL.MRCH.WL.CD,Merchandise imports by the reporting economy (current US$),Private Sector
TM.VAL.MRCH.RS.ZS,"Merchandise imports by the reporting economy, residual (% of total merchandise imports)",Private Sector
TM.VAL.MRCH.AL.ZS,Merchandise imports from economies in the Arab World (% of total merchandise imports),Private Sector
TM.VAL.MRCH.HI.ZS,Merchandise imports from high-income economies (% of total merchandise imports),Private Sector
TM.VAL.MRCH.R1.ZS,Merchandise imports from low- and middle-income economies in East Asia & Pacific (% of total merchandise imports),Private Sector
TM.VAL.MRCH.R2.ZS,Merchandise imports from low- and middle-income economies in Europe & Central Asia (% of total merchandise imports),Private Sector
TM.VAL.MRCH.R3.ZS,Merchandise imports from low- and middle-income economies in Latin America & the Caribbean (% of total merchandise imports),Private Sector
TM.VAL.MRCH.R4.ZS,Merchandise imports from low- and middle-income economies in Middle East & North Africa (% of total merchandise imports),Private Sector
TM.VAL.MRCH.R5.ZS,Merchandise imports from low- and middle-income economies in South Asia (% of total merchandise imports),Private Sector
TM.VAL.MRCH.R6.ZS,Merchandise imports from low- and middle-income economies in Sub-Saharan Africa (% of total merchandise imports),Private Sector
TM.VAL.MRCH.OR.ZS,Merchandise imports from low- and middle-income economies outside region (% of total merchandise imports),Private Sector
TM.VAL.MRCH.WR.ZS,Merchandise imports from low- and middle-income economies within region (% of total merchandise imports),Private Sector
TG.VAL.TOTL.GD.ZS,Merchandise trade (% of GDP),Private Sector
TT.PRI.MRCH.XD.WD,Net barter terms of trade index (2015 = 100),Private Sector
IC.BUS.NDNS.ZS,"New business density (new registrations per 1,000 people ages 15-64)",Private Sector
IC.BUS.NREG,New businesses registered (number),Private Sector
IC.TAX.METG,Number of visits or required meetings with tax officials (average for affected firms),Private Sector
TX.VAL.MMTL.ZS.UN,Ores and metals exports (% of merchandise exports),Private Sector
TM.VAL.MMTL.ZS.UN,Ores and metals imports (% of merchandise imports),Private Sector
IC.TAX.OTHR.CP.ZS,Other taxes payable by businesses (% of commercial profits),Private Sector
IC.ELC.OUTG,Power outages in firms in a typical month (number),Private Sector
IC.CRD.PRVT.ZS,Private credit bureau coverage (% of adults),Private Sector
IC.WRH.PROC,Procedures to build a warehouse (number),Private Sector
IC.PRP.PROC,Procedures to register property (number),Private Sector
IC.TAX.PRFT.CP.ZS,Profit tax (% of commercial profits),Private Sector
IC.CRD.PUBL.ZS,Public credit registry coverage (% of adults),Private Sector
TM.TAX.MRCH.IP.ZS,"Share of tariff lines with international peaks, all products (%)",Private Sector
TM.TAX.MANF.IP.ZS,"Share of tariff lines with international peaks, manufactured products (%)",Private Sector
TM.TAX.TCOM.IP.ZS,"Share of tariff lines with international peaks, primary products (%)",Private Sector
TM.TAX.MRCH.SR.ZS,"Share of tariff lines with specific rates, all products (%)",Private Sector
TM.TAX.MANF.SR.ZS,"Share of tariff lines with specific rates, manufactured products (%)",Private Sector
TM.TAX.TCOM.SR.ZS,"Share of tariff lines with specific rates, primary products (%)",Private Sector
IC.REG.PROC,Start-up procedures to register a business (number),Private Sector
IC.REG.PROC.FE,"Start-up procedures to register a business, female (number)",Private Sector
IC.REG.PROC.MA,"Start-up procedures to register a business, male (number)",Private Sector
IC.LGL.CRED.XQ,Strength of legal rights index (0=weak to 12=strong),Private Sector
TM.TAX.MRCH.SM.AR.ZS,"Tariff rate, applied, simple mean, all products (%)",Private Sector
TM.TAX.MANF.SM.AR.ZS,"Tariff rate, applied, simple mean, manufactured products (%)",Private Sector
TM.TAX.TCOM.SM.AR.ZS,"Tariff rate, applied, simple mean, primary products (%)",Private Sector
TM.TAX.MRCH.WM.AR.ZS,"Tariff rate, applied, weighted mean, all products (%)",Private Sector
TM.TAX.MANF.WM.AR.ZS,"Tariff rate, applied, weighted mean, manufactured products (%)",Private Sector
TM.TAX.TCOM.WM.AR.ZS,"Tariff rate, applied, weighted mean, primary products (%)",Private Sector
TM.TAX.MRCH.SM.FN.ZS,"Tariff rate, most favored nation, simple mean, all products (%)",Private Sector
TM.TAX.MANF.SM.FN.ZS,"Tariff rate, most favored nation, simple mean, manufactured products (%)",Private Sector
TM.TAX.TCOM.SM.FN.ZS,"Tariff rate, most favored nation, simple mean, primary products (%)",Private Sector
TM.TAX.MRCH.WM.FN.ZS,"Tariff rate, most favored nation, weighted mean, all products (%)",Private Sector
TM.TAX.MANF.WM.FN.ZS,"Tariff rate, most favored nation, weighted mean, manufactured products (%)",Private Sector
TM.TAX.TCOM.WM.FN.ZS,"Tariff rate, most favored nation, weighted mean, primary products (%)",Private Sector
IC.TAX.PAYM,Tax payments (number),Private Sector
IC.WRH.DURS,Time required to build a warehouse (days),Private Sector
IC.LGL.DURS,Time required to enforce a contract (days),Private Sector
IC.ELC.TIME,Time required to get electricity (days),Private Sector
IC.FRM.DURS,Time required to obtain an operating license (days),Private Sector
IC.PRP.DURS,Time required to register property (days),Private Sector
IC.REG.DURS,Time required to start a business (days),Private Sector
IC.REG.DURS.FE,"Time required to start a business, female (days)",Private Sector
IC.REG.DURS.MA,"Time required to start a business, male (days)",Private Sector
IC.GOV.DURS.ZS,Time spent dealing with the requirements of government regulations (% of senior management time),Private Sector
IC.EXP.TMBC,"Time to export, border compliance (hours)",Private Sector
IC.EXP.TMDC,"Time to export, documentary compliance (hours)",Private Sector
IC.IMP.TMBC,"Time to import, border compliance (hours)",Private Sector
IC.IMP.TMDC,"Time to import, documentary compliance (hours)",Private Sector
IC.ELC.DURS,Time to obtain an electrical connection (days),Private Sector
IC.TAX.DURS,Time to prepare and pay taxes (hours),Private Sector
IC.ISV.DURS,Time to resolve insolvency (years),Private Sector
IC.TAX.TOTL.CP.ZS,Total tax and contribution rate (% of profit),Private Sector
BG.GSR.NFSV.GD.ZS,Trade in services (% of GDP),Private Sector
TX.VAL.TRAN.ZS.WT,Transport services (% of commercial service exports),Private Sector
TM.VAL.TRAN.ZS.WT,Transport services (% of commercial service imports),Private Sector
TX.VAL.TRVL.ZS.WT,Travel services (% of commercial service exports),Private Sector
TM.VAL.TRVL.ZS.WT,Travel services (% of commercial service imports),Private Sector
IC.FRM.OUTG.ZS,Value lost due to electrical outages (% of sales for affected firms),Private Sector
MS.MIL.TOTL.TF.ZS,Armed forces personnel (% of total labor force),Public Sector
MS.MIL.TOTL.P1,"Armed forces personnel, total",Public Sector
MS.MIL.XPRT.KD,Arms exports (SIPRI trend indicator values),Public Sector
MS.MIL.MPRT.KD,Arms imports (SIPRI trend indicator values),Public Sector
VC.BTL.DETH,Battle-related deaths (number of people),Public Sector
IQ.CPA.HRES.XQ,CPIA building human resources rating (1=low to 6=high),Public Sector
IQ.CPA.BREG.XQ,CPIA business regulatory environment rating (1=low to 6=high),Public Sector
IQ.CPA.DEBT.XQ,CPIA debt policy rating (1=low to 6=high),Public Sector
IQ.CPA.ECON.XQ,CPIA economic management cluster average (1=low to 6=high),Public Sector
IQ.CPA.REVN.XQ,CPIA efficiency of revenue mobilization rating (1=low to 6=high),Public Sector
IQ.CPA.PRES.XQ,CPIA equity of public resource use rating (1=low to 6=high),Public Sector
IQ.CPA.FINS.XQ,CPIA financial sector rating (1=low to 6=high),Public Sector
IQ.CPA.FISP.XQ,CPIA fiscal policy rating (1=low to 6=high),Public Sector
IQ.CPA.GNDR.XQ,CPIA gender equality rating (1=low to 6=high),Public Sector
IQ.CPA.MACR.XQ,CPIA macroeconomic management rating (1=low to 6=high),Public Sector
IQ.CPA.SOCI.XQ,CPIA policies for social inclusion/equity cluster average (1=low to 6=high),Public Sector
IQ.CPA.ENVR.XQ,CPIA policy and institutions for environmental sustainability rating (1=low to 6=high),Public Sector
IQ.CPA.PROP.XQ,CPIA property rights and rule-based governance rating (1=low to 6=high),Public Sector
IQ.CPA.PUBS.XQ,CPIA public sector management and institutions cluster average (1=low to 6=high),Public Sector
IQ.CPA.FINQ.XQ,CPIA quality of budgetary and financial management rating (1=low to 6=high),Public Sector
IQ.CPA.PADM.XQ,CPIA quality of public administration rating (1=low to 6=high),Public Sector
IQ.CPA.PROT.XQ,CPIA social protection rating (1=low to 6=high),Public Sector
IQ.CPA.STRC.XQ,CPIA structural policies cluster average (1=low to 6=high),Public Sector
IQ.CPA.TRAD.XQ,CPIA trade rating (1=low to 6=high),Public Sector
IQ.CPA.TRAN.XQ,"CPIA transparency, accountability, and corruption in the public sector rating (1=low to 6=high)",Public Sector
GC.DOD.TOTL.GD.ZS,"Central government debt, total (% of GDP)",Public Sector
GC.DOD.TOTL.CN,"Central government debt, total (current LCU)",Public Sector
GC.XPN.COMP.ZS,Compensation of employees (% of expense),Public Sector
GC.XPN.COMP.CN,Compensation of employees (current LCU),Public Sector
CC.EST,Control of Corruption: Estimate,Public Sector
CC.NO.SRC,Control of Corruption: Number of Sources,Public Sector
CC.PER.RNK,Control of Corruption: Percentile Rank,Public Sector
CC.PER.RNK.LOWER,"Control of Corruption: Percentile Rank, Lower Bound of 90% Confidence Interval",Public Sector
CC.PER.RNK.UPPER,"Control of Corruption: Percentile Rank, Upper Bound of 90% Confidence Interval",Public Sector
CC.STD.ERR,Control of Corruption: Standard Error,Public Sector
GC.TAX.IMPT.ZS,Customs and other import duties (% of tax revenue),Public Sector
GC.TAX.IMPT.CN,Customs and other import duties (current LCU),Public Sector
GC.XPN.TOTL.GD.ZS,Expense (% of GDP),Public Sector
GC.XPN.TOTL.CN,Expense (current LCU),Public Sector
GC.XPN.GSRV.ZS,Goods and services expense (% of expense),Public Sector
GC.XPN.GSRV.CN,Goods and services expense (current LCU),Public Sector
GE.EST,Government Effectiveness: Estimate,Public Sector
GE.NO.SRC,Government Effectiveness: Number of Sources,Public Sector
GE.PER.RNK,Government Effectiveness: Percentile Rank,Public Sector
GE.PER.RNK.LOWER,"Government Effectiveness: Percentile Rank, Lower Bound of 90% Confidence Interval",Public Sector
GE.PER.RNK.UPPER,"Government Effectiveness: Percentile Rank, Upper Bound of 90% Confidence Interval",Public Sector
GE.STD.ERR,Government Effectiveness: Standard Error,Public Sector
GC.REV.GOTR.ZS,Grants and other revenue (% of revenue),Public Sector
GC.REV.GOTR.CN,Grants and other revenue (current LCU),Public Sector
HD.HCI.OVRL,Human Capital Index (HCI) (scale 0-1),Public Sector
HD.HCI.OVRL.FE,"Human Capital Index (HCI), Female (scale 0-1)",Public Sector
HD.HCI.OVRL.LB.FE,"Human Capital Index (HCI), Female, Lower Bound (scale 0-1)",Public Sector
HD.HCI.OVRL.UB.FE,"Human Capital Index (HCI), Female, Upper Bound (scale 0-1)",Public Sector
HD.HCI.OVRL.LB,"Human Capital Index (HCI), Lower Bound (scale 0-1)",Public Sector
HD.HCI.OVRL.MA,"Human Capital Index (HCI), Male (scale 0-1)",Public Sector
HD.HCI.OVRL.LB.MA,"Human Capital Index (HCI), Male, Lower Bound (scale 0-1)",Public Sector
HD.HCI.OVRL.UB.MA,"Human Capital Index (HCI), Male, Upper Bound (scale 0-1)",Public Sector
HD.HCI.OVRL.UB,"Human Capital Index (HCI), Upper Bound (scale 0-1)",Public Sector
IQ.CPA.IRAI.XQ,IDA resource allocation index (1=low to 6=high),Public Sector
VC.IHR.PSRC.P5,"Intentional homicides (per 100,000 people)",Public Sector
VC.IHR.PSRC.FE.P5,"Intentional homicides, female (per 100,000 female)",Public Sector
VC.IHR.PSRC.MA.P5,"Intentional homicides, male (per 100,000 male)",Public Sector
GC.XPN.INTP.ZS,Interest payments (% of expense),Public Sector
GC.XPN.INTP.RV.ZS,Interest payments (% of revenue),Public Sector
GC.XPN.INTP.CN,Interest payments (current LCU),Public Sector
VC.IDP.NWCV,"Internally displaced persons, new displacement associated with conflict and violence (number of cases)",Public Sector
VC.IDP.NWDS,"Internally displaced persons, new displacement associated with disasters (number of cases)",Public Sector
VC.IDP.TOCV,"Internally displaced persons, total displaced by conflict and violence (number of people)",Public Sector
IQ.SCI.MTHD,Methodology assessment of statistical capacity (scale 0 - 100),Public Sector
MS.MIL.XPND.GD.ZS,Military expenditure (% of GDP),Public Sector
MS.MIL.XPND.ZS,Military expenditure (% of general government expenditure),Public Sector
MS.MIL.XPND.CN,Military expenditure (current LCU),Public Sector
MS.MIL.XPND.CD,Military expenditure (current USD),Public Sector
GC.AST.TOTL.GD.ZS,Net acquisition of financial assets (% of GDP),Public Sector
GC.AST.TOTL.CN,Net acquisition of financial assets (current LCU),Public Sector
GC.LBL.TOTL.GD.ZS,"Net incurrence of liabilities, total (% of GDP)",Public Sector
GC.LBL.TOTL.CN,"Net incurrence of liabilities, total (current LCU)",Public Sector
GC.NFN.TOTL.GD.ZS,Net investment in nonfinancial assets (% of GDP),Public Sector
GC.NFN.TOTL.CN,Net investment in nonfinancial assets (current LCU),Public Sector
GC.NLD.TOTL.GD.ZS,Net lending (+) / net borrowing (-) (% of GDP),Public Sector
GC.NLD.TOTL.CN,Net lending (+) / net borrowing (-) (current LCU),Public Sector
GC.XPN.OTHR.ZS,Other expense (% of expense),Public Sector
GC.XPN.OTHR.CN,Other expense (current LCU),Public Sector
GC.TAX.OTHR.RV.ZS,Other taxes (% of revenue),Public Sector
GC.TAX.OTHR.CN,Other taxes (current LCU),Public Sector
IQ.SCI.PRDC,Periodicity and timeliness assessment of statistical capacity (scale 0 - 100),Public Sector
PV.EST,Political Stability and Absence of Violence/Terrorism: Estimate,Public Sector
PV.NO.SRC,Political Stability and Absence of Violence/Terrorism: Number of Sources,Public Sector
PV.PER.RNK,Political Stability and Absence of Violence/Terrorism: Percentile Rank,Public Sector
PV.PER.RNK.LOWER,"Political Stability and Absence of Violence/Terrorism: Percentile Rank, Lower Bound of 90% Confidence Interval",Public Sector
PV.PER.RNK.UPPER,"Political Stability and Absence of Violence/Terrorism: Percentile Rank, Upper Bound of 90% Confidence Interval",Public Sector
PV.STD.ERR,Political Stability and Absence of Violence/Terrorism: Standard Error,Public Sector
GF.XPD.BUDG.ZS,Primary government expenditures as a proportion of original approved budget (%),Public Sector
SG.GEN.PARL.ZS,Proportion of seats held by women in national parliaments (%),Public Sector
IC.CRD.PUBL.ZS,Public credit registry coverage (% of adults),Public Sector
RQ.EST,Regulatory Quality: Estimate,Public Sector
RQ.NO.SRC,Regulatory Quality: Number of Sources,Public Sector
RQ.PER.RNK,Regulatory Quality: Percentile Rank,Public Sector
RQ.PER.RNK.LOWER,"Regulatory Quality: Percentile Rank, Lower Bound of 90% Confidence Interval",Public Sector
RQ.PER.RNK.UPPER,"Regulatory Quality: Percentile Rank, Upper Bound of 90% Confidence Interval",Public Sector
RQ.STD.ERR,Regulatory Quality: Standard Error,Public Sector
GC.REV.XGRT.GD.ZS,"Revenue, excluding grants (% of GDP)",Public Sector
GC.REV.XGRT.CN,"Revenue, excluding grants (current LCU)",Public Sector
RL.EST,Rule of Law: Estimate,Public Sector
RL.NO.SRC,Rule of Law: Number of Sources,Public Sector
RL.PER.RNK,Rule of Law: Percentile Rank,Public Sector
RL.PER.RNK.LOWER,"Rule of Law: Percentile Rank, Lower Bound of 90% Confidence Interval",Public Sector
RL.PER.RNK.UPPER,"Rule of Law: Percentile Rank, Upper Bound of 90% Confidence Interval",Public Sector
RL.STD.ERR,Rule of Law: Standard Error,Public Sector
GC.REV.SOCL.ZS,Social contributions (% of revenue),Public Sector
GC.REV.SOCL.CN,Social contributions (current LCU),Public Sector
IQ.SCI.SRCE,Source data assessment of statistical capacity (scale 0 - 100),Public Sector
IQ.SCI.OVRL,Statistical Capacity Score (Overall Average) (scale 0 - 100),Public Sector
IQ.SPI.OVRL,Statistical performance indicators (SPI): Overall score (scale 0-100),Public Sector
IQ.SPI.PIL1,Statistical performance indicators (SPI): Pillar 1 data use score (scale 0-100),Public Sector
IQ.SPI.PIL2,Statistical performance indicators (SPI): Pillar 2 data services score (scale 0-100),Public Sector
IQ.SPI.PIL3,Statistical performance indicators (SPI): Pillar 3 data products score  (scale 0-100),Public Sector
IQ.SPI.PIL4,Statistical performance indicators (SPI): Pillar 4 data sources score (scale 0-100),Public Sector
IQ.SPI.PIL5,Statistical performance indicators (SPI): Pillar 5 data infrastructure score (scale 0-100),Public Sector
IC.LGL.CRED.XQ,Strength of legal rights index (0=weak to 12=strong),Public Sector
GC.XPN.TRFT.ZS,Subsidies and other transfers (% of expense),Public Sector
GC.XPN.TRFT.CN,Subsidies and other transfers (current LCU),Public Sector
IC.TAX.PAYM,Tax payments (number),Public Sector
GC.TAX.TOTL.GD.ZS,Tax revenue (% of GDP),Public Sector
GC.TAX.TOTL.CN,Tax revenue (current LCU),Public Sector
GC.TAX.EXPT.ZS,Taxes on exports (% of tax revenue),Public Sector
GC.TAX.EXPT.CN,Taxes on exports (current LCU),Public Sector
GC.TAX.GSRV.RV.ZS,Taxes on goods and services (% of revenue),Public Sector
GC.TAX.GSRV.VA.ZS,Taxes on goods and services (% value added of industry and services),Public Sector
GC.TAX.GSRV.CN,Taxes on goods and services (current LCU),Public Sector
GC.TAX.YPKG.RV.ZS,"Taxes on income, profits and capital gains (% of revenue)",Public Sector
GC.TAX.YPKG.ZS,"Taxes on income, profits and capital gains (% of total taxes)",Public Sector
GC.TAX.YPKG.CN,"Taxes on income, profits and capital gains (current LCU)",Public Sector
GC.TAX.INTT.RV.ZS,Taxes on international trade (% of revenue),Public Sector
GC.TAX.INTT.CN,Taxes on international trade (current LCU),Public Sector
IC.TAX.DURS,Time to prepare and pay taxes (hours),Public Sector
IC.TAX.TOTL.CP.ZS,Total tax and contribution rate (% of profit),Public Sector
VA.EST,Voice and Accountability: Estimate,Public Sector
VA.NO.SRC,Voice and Accountability: Number of Sources,Public Sector
VA.PER.RNK,Voice and Accountability: Percentile Rank,Public Sector
VA.PER.RNK.LOWER,"Voice and Accountability: Percentile Rank, Lower Bound of 90% Confidence Interval",Public Sector
VA.PER.RNK.UPPER,"Voice and Accountability: Percentile Rank, Upper Bound of 90% Confidence Interval",Public Sector
VA.STD.ERR,Voice and Accountability: Standard Error,Public Sector
BM.GSR.ROYL.CD,"Charges for the use of intellectual property, payments (BoP, current US$)",Science & Technology
BX.GSR.ROYL.CD,"Charges for the use of intellectual property, receipts (BoP, current US$)",Science & Technology
TX.VAL.TECH.MF.ZS,High-technology exports (% of manufactured exports),Science & Technology
TX.VAL.TECH.CD,High-technology exports (current US$),Science & Technology
IP.PAT.NRES,"Patent applications, nonresidents",Science & Technology
IP.PAT.RESD,"Patent applications, residents",Science & Technology
GB.XPD.RSDV.GD.ZS,Research and development expenditure (% of GDP),Science & Technology
SP.POP.SCIE.RD.P6,Researchers in R&D (per million people),Science & Technology
IP.JRN.ARTC.SC,Scientific and technical journal articles,Science & Technology
SP.POP.TECH.RD.P6,Technicians in R&D (per million people),Science & Technology
SP.ADO.TFRT,"Adolescent fertility rate (births per 1,000 women ages 15-19)",Social Development
SL.TLF.0714.FE.ZS,"Children in employment, female (% of female children ages 7-14)",Social Development
SL.TLF.0714.MA.ZS,"Children in employment, male (% of male children ages 7-14)",Social Development
SL.TLF.0714.SW.ZS,"Children in employment, study and work (% of children in employment, ages 7-14)",Social Development
SL.TLF.0714.SW.FE.ZS,"Children in employment, study and work, female (% of female children in employment, ages 7-14)",Social Development
SL.TLF.0714.SW.MA.ZS,"Children in employment, study and work, male (% of male children in employment, ages 7-14)",Social Development
SL.TLF.0714.ZS,"Children in employment, total (% of children ages 7-14)",Social Development
SL.TLF.0714.WK.ZS,"Children in employment, work only (% of children in employment, ages 7-14)",Social Development
SL.TLF.0714.WK.FE.ZS,"Children in employment, work only, female (% of female children in employment, ages 7-14)",Social Development
SL.TLF.0714.WK.MA.ZS,"Children in employment, work only, male (% of male children in employment, ages 7-14)",Social Development
SL.TLF.ACTI.1524.FE.ZS,"Labor force participation rate for ages 15-24, female (%) (modeled ILO estimate)",Social Development
